{
  "format": "s11tnext.catalog",
  "compilerVersion": "0.0.0",
  "releaseProfile": "production",
  "policyDigest": "sha256:0089bb95abe774bb6a20a07e42702f06547a88052f2cf5221ce960338c01211e",
  "createdFrom": {
    "configPath": "s11tnext.config.toml",
    "sourceFiles": [
      "contexts/codingAgent/identity.context.toml"
    ]
  },
  "contexts": {
    "codingAgent.identity": {
      "key": "codingAgent.identity",
      "owner": "coding-agent",
      "contentKind": "text",
      "sourceLocale": "ja-JP",
      "requiredLocales": [
        "ja-JP",
        "en-US"
      ],
      "variables": {
        "taskGoal": {
          "required": true,
          "type": "string",
          "trust": "untrusted",
          "placement": "delimited-context",
          "encoding": "json-string"
        }
      },
      "locales": {
        "en-US": {
          "sections": [
            {
              "id": "role.identity",
              "kind": "instruction",
              "severity": "must",
              "enforcement": "prompt",
              "optimizable": false,
              "segments": [
                {
                  "type": "literal",
                  "value": "You are a Coding Agent that automates user tasks."
                }
              ]
            },
            {
              "id": "task.goal-context",
              "kind": "runtime-fact",
              "severity": "should",
              "enforcement": "prompt",
              "optimizable": false,
              "segments": [
                {
                  "type": "literal",
                  "value": "<TASK_GOAL_JSON_STRING>\n"
                },
                {
                  "type": "variable",
                  "name": "taskGoal"
                },
                {
                  "type": "literal",
                  "value": "\n</TASK_GOAL_JSON_STRING>"
                }
              ]
            }
          ],
          "artifactHash": "sha256:4581c17a7a90148afb7b2064918c66600fbd9c69e8279e7d3ef5e272010665c0"
        },
        "ja-JP": {
          "sections": [
            {
              "id": "role.identity",
              "kind": "instruction",
              "severity": "must",
              "enforcement": "prompt",
              "optimizable": false,
              "segments": [
                {
                  "type": "literal",
                  "value": "あなたはユーザーTaskを自動化するCoding Agentです。"
                }
              ]
            },
            {
              "id": "task.goal-context",
              "kind": "runtime-fact",
              "severity": "should",
              "enforcement": "prompt",
              "optimizable": false,
              "segments": [
                {
                  "type": "literal",
                  "value": "<TASK_GOAL_JSON_STRING>\n"
                },
                {
                  "type": "variable",
                  "name": "taskGoal"
                },
                {
                  "type": "literal",
                  "value": "\n</TASK_GOAL_JSON_STRING>"
                }
              ]
            }
          ],
          "artifactHash": "sha256:b3cc6f380af61cd188bdd3eaa4ef98951ad7ff9294b33088fe030b9b1fc12160"
        }
      },
      "definitionHash": "sha256:9d6ac59dc4e56930ec3425dc696206b90eb2bf51ad6d399f52c4642320e2910f",
      "releaseDigest": "sha256:428aae00e00195554077b63a67748ae263027946eb4e7f7fbe34bf0c89b6efa7"
    }
  },
  "catalogDigest": "sha256:c5e95698f07f385816bf04f2ac76f12f117a4b04726b1ad3cf9f95a4458f7b93"
}
